{
  "id": "windmill",
  "category": "production",
  "era": 1,
  "footprint": [2, 2],
  "placement": {
    "terrain": ["plains", "forest"]
  },
  "cost": { "timber": 3 },
  "buildDays": 1,
  "workforce": { "tier": "villagers", "count": 3 },
  "recipe": "grind_flour",
  "start": true,
  "tags": ["processing"]
}
