{
  "id": "fishing_hut",
  "category": "production",
  "era": 1,
  "footprint": [2, 2],
  "placement": {
    "terrain": ["plains", "forest"],
    "coastline": true,
    "areaYield": {
      "kind": "radius",
      "terrain": ["sea"],
      "radius": 5,
      "fullAt": 30,
      "exclusive": true
    }
  },
  "cost": { "timber": 3, "salt": 1 },
  "buildDays": 1,
  "workforce": { "tier": "settlers", "count": 3 },
  "recipe": "catch_fish",
  "start": true,
  "tags": ["fishing", "gatherer"]
}
