{
  "id": "orchard",
  "category": "production",
  "era": 1,
  "footprint": [4, 4],
  "placement": {
    "terrain": ["plains"]
  },
  "cost": { "timber": 4 },
  "buildDays": 2,
  "workforce": { "tier": "settlers", "count": 3 },
  "recipe": "grow_apples",
  "start": true,
  "tags": ["farm", "gatherer"]
}
