{
  "id": "rotation_farm",
  "category": "production",
  "era": 1,
  "footprint": [5, 5],
  "placement": {
    "terrain": ["plains"],
    "fertility": { "crop": "grain", "minPercent": 25 },
    "areaYield": { "kind": "footprint_fertility" }
  },
  "cost": { "timber": 4 },
  "buildDays": 2,
  "workforce": { "tier": "villagers", "count": 3 },
  "recipe": "grow_grain",
  "upgradeOf": "grain_farm",
  "tags": ["farm", "gatherer", "seasonal"]
}
